{
  "format": "TDriveShot",
  "version": 1,
  "shot": "Opening01",
  "frameRate": 30,
  "range": [
    0,
    300
  ],
  "cameras": [
    {
      "name": "CAM_Main",
      "node": "CAM_Main",
      "start": 0,
      "end": 150
    },
    {
      "name": "CAM_Close",
      "node": "CAM_Close",
      "start": 151,
      "end": 300
    }
  ],
  "characters": [],
  "props": [],
  "events": [
    {
      "frame": 75,
      "key": "Hit"
    }
  ],
  "export": {
    "dir": "",
    "category": "Cutscene",
    "includeEvents": false
  }
}
